"","ReleaseDate","Title","ProductionBudget","OpeningWeekend","DomesticBox Office","WorldwideBox Office","Trailer","Genre","Running_Time","Keywords","Franchise"
"959","Mar 18, 2011","Limitless","$27,000,000","$18,907,302","$79,249,455","$155,564,919","Play","Thriller/Suspense","105 minutes","Addiction, Voiceover/Narration, Surprise Twist, Rags to Riches, Foreign Language, Non-Chronological, Faulty Memory, Relationships Gone Wrong, Political, Narcotics, Pharmaceuticals, Hitmen, Conspiracy Theory, Writing and Writers, Wish Granters, Visual Effects, Super Soldier Serum",NA
"960","Mar 11, 2011","Battle: Los Angeles","$70,000,000","$35,573,187","$83,552,429","$213,463,976","Play","Action","116 minutes","Alien Invasion, Inspired by a True Story, Rescue, War, One Last Job",NA
"961","Feb 4, 2011","Sanctum","$30,000,000","$9,447,930","$23,209,310","$104,283,753","Play","Adventure","109 minutes","Underground, Underwater, 3-D, Escape, Disaster, IMAX: DMR",NA
"962","Dec 22, 2010","Little Fockers","$100,000,000","$30,833,665","$148,438,600","$310,650,574","Play","Comedy","98 minutes","Dysfunctional Family, Twins, Mid-Life Crisis, In-Laws / Future In-Laws","Meet the Parents"
"963","Dec 10, 2010","The Fighter","$11,000,000","$300,010","$93,617,009","$129,262,388","Play","Drama","115 minutes","Boxing, Comeback, Dysfunctional Family, Addiction, 2011 Oscars Best Picture Nominee",NA
"964","Nov 12, 2010","Skyline","$10,000,000","$11,692,415","$21,416,355","$68,264,973","Play","Thriller/Suspense","94 minutes","Alien Invasion, Escape","Skyline"
"965","Oct 1, 2010","The Social Network","$40,000,000","$22,445,653","$96,962,694","$224,922,135","Play","Drama","120 minutes","Same Actor, Multiple Roles, Twins, Internet, Boss From Hell, 2011 Oscars Best Picture Nominee",NA
"966","Aug 20, 2010","Nanny McPhee and the Big Bang","$35,000,000","$8,407,685","$29,197,642","$97,799,865","Play","Adventure","109 minutes","Dysfunctional Family, Secret Magic, World War II, Slobs vs. Snobs","Nanny McPhee"
"967","Jul 23, 2010","Salt","$130,000,000","$36,011,243","$118,311,368","$290,650,494","Play","Thriller/Suspense","100 minutes",NA,"Salt"
"968","Jun 25, 2010","Grown Ups","$75,000,000","$40,506,564","$162,001,186","$272,223,430","Play","Comedy","102 minutes",NA,"Grown Ups"
"969","Jun 4, 2010","Get Him to the Greek","$40,000,000","$17,570,955","$61,153,526","$91,455,875","Play","Comedy","108 minutes","Judd Apatow Buddy Comedy, Rock 'n' Roll, Road Trip, Music Industry, Gratuitous Cameos, Dysfunctional Family, Comeback",NA
"970","Feb 12, 2010","The Wolfman","$150,000,000","$31,479,235","$62,189,884","$142,634,358","","Horror","102 minutes","Werewolf",NA
"971","Feb 5, 2010","Dear John","$25,000,000","$30,468,614","$80,014,842","$142,033,509","Play","Drama","107 minutes","Romance",NA
"972","Dec 25, 2009","It’s Complicated","$85,000,000","$22,100,820","$112,735,375","$224,614,744","Play","Romantic Comedy","118 minutes","Romance",NA
"973","Dec 18, 2009","Nine","$80,000,000","$257,232","$19,676,965","$53,508,858","Play","Musical","118 minutes",NA,NA
"974","Dec 4, 2009","Brothers","$26,000,000","$9,527,848","$28,544,157","$45,043,870","Play","Drama","105 minutes","War, Afghanistan War, Foreign-Language Remake",NA
"975","Oct 9, 2009","Couples Retreat","$60,000,000","$34,286,740","$109,205,660","$172,450,423","","Comedy","113 minutes",NA,NA
"976","Oct 2, 2009","Zombieland","$23,600,000","$24,733,155","$75,590,286","$102,236,596","","Comedy","87 minutes","Zombies, Unnamed Character","Zombieland"
"977","Jul 31, 2009","Funny People","$72,500,000","$22,657,780","$51,855,045","$71,880,305","","Comedy","146 minutes","Terminal Illness",NA
"978","Jul 24, 2009","The Ugly Truth","$38,000,000","$27,605,576","$88,915,214","$205,298,907","Play","Romantic Comedy","95 minutes","Romance",NA
"979","Jul 1, 2009","Public Enemies","$102,500,000","$25,271,675","$97,104,620","$212,282,709","","Drama","140 minutes",NA,NA
"980","Jun 12, 2009","The Taking of Pelham 123","$110,000,000","$23,373,102","$65,452,312","$152,364,370","","Action","106 minutes",NA,NA
"981","Jan 16, 2009","Paul Blart: Mall Cop","$26,000,000","$31,832,636","$146,336,178","$185,904,750","","Adventure","91 minutes",NA,"Paul Blart: Mall Cop"
"982","Dec 19, 2008","Seven Pounds","$54,000,000","$14,851,136","$69,951,824","$166,617,328","","Drama","123 minutes",NA,NA
"983","Oct 10, 2008","The Express","$37,500,000","$4,562,675","$9,793,406","$9,813,309","","Drama","130 minutes","Football, Biography, Inspirational Sports",NA
"984","Sep 12, 2008","Burn After Reading","$37,000,000","$19,128,001","$60,355,347","$168,167,798","","Black Comedy","97 minutes","Secret Agent",NA
"985","Aug 22, 2008","Death Race","$65,000,000","$12,621,090","$36,316,032","$72,516,819","","Action","110 minutes","Auto Racing, Reality TV, Prison","Death Race"
"986","Aug 12, 2008","Felon","","","","","",NA,NA,"Direct-to-Video, Neo Nazis",NA
"987","Aug 6, 2008","Pineapple Express","$26,000,000","$23,245,025","$87,341,380","$102,404,019","","Comedy","112 minutes","Organized Crime, Corrupt Cops, Judd Apatow Buddy Comedy",NA
"988","Jul 25, 2008","Step Brothers","$65,000,000","$30,940,732","$100,468,793","$128,468,793","","Comedy","95 minutes","Unexpected Families, Dysfunctional Family, Delayed Adulthood, Judd Apatow Buddy Comedy",NA
"989","Jul 1, 2008","Hancock","$150,000,000","$62,603,879","$227,946,274","$624,234,272","","Action","92 minutes","Brooklyn, Martial Arts, Trains, Car Accident, Heist, Police Standoff, Faulty Memory, Hostage","Hancock"
"990","Jun 27, 2008","Wanted","$75,000,000","$50,927,085","$134,508,551","$342,416,460","","Action","110 minutes","Hitmen, Revenge",NA
"991","Jun 6, 2008","You Don't Mess With the Zohan","$90,000,000","$38,531,374","$100,018,837","$202,910,991","","Comedy","113 minutes","Secret Agent, Beauty Industry, Mistaken Identity, Judd Apatow Buddy Comedy",NA
"992","Apr 25, 2008","Baby Mama","$30,000,000","$17,407,110","$60,494,212","$64,170,447","","Comedy","99 minutes","Unexpected Families, Unconventional Pregnancies, Baby Shower, Infertility",NA
"993","Apr 18, 2008","The Forbidden Kingdom","$55,000,000","$21,401,121","$52,075,270","$129,075,270","","Action","105 minutes","Martial Arts, Time Travel",NA
"994","Mar 28, 2008","21","$35,000,000","$24,105,943","$81,159,365","$159,846,429","","Thriller/Suspense","122 minutes","Gambling, Whitewashed Casting",NA
"995","Mar 7, 2008","The Bank Job","$20,000,000","$5,935,256","$30,060,660","$66,143,005","","Thriller/Suspense","110 minutes","Heist, Crime Caper",NA
"996","Feb 29, 2008","The Other Boleyn Girl","$40,000,000","$8,203,061","$26,814,957","$78,269,970","","Drama","115 minutes","Royalty, Costume Drama",NA
"997","Feb 22, 2008","Vantage Point","$40,000,000","$22,874,936","$72,266,306","$150,886,329","","Thriller/Suspense","89 minutes","Hitmen, Political",NA
"998","Dec 21, 2007","Charlie Wilson's War","$75,000,000","$9,656,250","$66,661,095","$119,512,771","","Drama","97 minutes","War, Secret Agent",NA
"999","Dec 21, 2007","Walk Hard: The Dewey Cox Story","$35,000,000","$4,174,383","$18,317,151","$20,606,053","","Comedy","96 minutes","Spoof, Musicians, Judd Apatow Buddy Comedy",NA
"1000","Dec 7, 2007","Atonement","$30,000,000","$796,836","$50,980,159","$129,779,728","","Drama","123 minutes","Coming of Age",NA
"1001","Nov 2, 2007","American Gangster","$100,000,000","$43,565,135","$130,164,645","$267,985,456","","Drama","157 minutes","Vietnam War, Organized Crime, Film Noir",NA
"1002","Sep 7, 2007","3:10 to Yuma","$48,000,000","$14,035,033","$53,606,916","$71,171,825","","Western","122 minutes","Gangs",NA
"1003","Jul 20, 2007","I Now Pronounce You Chuck a…","$85,000,000","$34,233,750","$119,725,280","$185,708,462","","Comedy","115 minutes","Buddy Comedy",NA
"1004","Jun 22, 2007","Evan Almighty","$175,000,000","$31,192,615","$100,289,690","$174,131,329","","Comedy","96 minutes","Religious, End of the World, Development Hell","Bruce Almighty"
"1005","Mar 2, 2007","Full of It","","$11,431","$14,273","$14,273","","Comedy",NA,"New Guy/Girl in School",NA
"1006","Feb 16, 2007","Ghost Rider","$120,000,000","$45,388,836","$115,802,596","$229,545,589","","Action","110 minutes","Marvel Comics, Good vs. Evil, Demons, Heaven and Hell, Visual Effects","Ghost Rider"
"1007","Jan 26, 2007","Catch and Release","","$7,658,898","$15,432,542","$15,432,542","","Romantic Comedy","111 minutes","Romance",NA
"1008","Dec 15, 2006","The Pursuit of Happyness","$55,000,000","$26,541,709","$162,586,036","$307,311,093","","Drama","117 minutes","Rags to Riches, Voiceover/Narration, Sales Clerk, Underdog, Job Interview, Messy Divorce, 1980s, Homeless, Family Affair, Relatives Playing Relatives",NA
"1009","Dec 8, 2006","The Holiday","$85,000,000","$12,778,913","$63,280,000","$205,190,324","","Romantic Comedy","135 minutes","Christmas, Relationships Gone Wrong, Romance",NA
"1010","Aug 4, 2006","Talladega Nights: The Balla…","$73,000,000","$47,042,215","$148,213,377","$162,870,525","","Comedy","104 minutes","Auto Racing, Judd Apatow Buddy Comedy",NA
"1011","Jul 21, 2006","Monster House","$75,000,000","$22,217,226","$73,661,010","$141,267,370","","Adventure","91 minutes","3-D, Babysitters",NA
"1012","Apr 28, 2006","R.V.","$55,000,000","$16,414,767","$71,724,497","$87,473,024","","Adventure","98 minutes","Family Vacations, Dysfunctional Family, Road Trip",NA
"1013","","","","","","","",NA,NA,NA,NA
"1014","Averages","","$56,483,333","$20,598,583","$69,153,712","$141,909,381","",NA,NA,NA,NA
"1015","Totals","98","$5,083,500,000","","$6,638,756,322","$13,765,209,992","",NA,NA,NA,NA
"1016","Feb 22, 2019","The Turning","","","","","","Horror",NA,NA,NA
"1017","Nov 16, 2018","Green Book","$28,900,000","$313,000","$313,000","$313,000","Play","Drama","130 minutes","Bigotry, Discrimination, Road Trip, African-American, Musicians, On Tour, 1960s",NA
"1018","Oct 12, 2018","First Man","$60,000,000","$16,006,065","$44,356,310","$96,656,310","Play","Drama","141 minutes","1960s, Space Program, Astronaut, Astrophysics, Biography",NA
"1019","Dec 22, 2017","The Post","$50,000,000","$526,011","$81,903,458","$179,769,457","Play","Drama","115 minutes","Newspaper Industry, Political, Government Corruption, Cover Up, Vietnam War, News, Investigative Journalist",NA
"1020","Oct 27, 2017","Thank You for Your Service","$20,000,000","$3,817,700","$9,479,390","$9,985,316","Play","Drama","108 minutes","Iraq War, Returning Soldiers, PTSD, Ensemble",NA
"1021","Mar 31, 2017","Ghost in the Shell","$110,000,000","$18,676,033","$40,563,557","$167,918,847","Play","Action","100 minutes","Live Action Cartoon, Robot, Cyborg, Dystopia, Implanted Memory, Organized Crime",NA
"1022","Dec 9, 2016","Office Christmas Party","$45,000,000","$16,890,204","$54,767,494","$91,334,989","Play","Comedy","105 minutes","Christmas, Sibling Rivalry, Dysfunctional Family, Parties Gone Wild, Corporate Life, Narcotics, Black Out Drunk",NA
"1023","Nov 4, 2016","Trolls","$125,000,000","$46,581,142","$153,707,064","$344,118,105","Play","Adventure","93 minutes","Food, Rescue, Escape, Makeover",NA
"1024","Oct 7, 2016","The Girl on the Train","$45,000,000","$24,536,265","$75,395,035","$174,304,381","Play","Thriller/Suspense","112 minutes","Addiction, Relationships Gone Wrong, Missing Person, Depression, Infertility, Black Out Drunk, Gaslighting",NA
"1025","Sep 2, 2016","The Light Between Oceans","$20,000,000","$4,765,838","$12,545,979","$22,282,236","Play","Drama","132 minutes","Unexpected Families, Missing Child, Adopted Family, Australia, Death of a Spouse or Fiancée / Fiancé, 1920s",NA
"1026","Oct 16, 2015","Bridge of Spies","$40,000,000","$15,371,203","$72,313,754","$162,498,338","Play","Thriller/Suspense","141 minutes","2016 Oscars Best Picture Nominee, Cold War, Berlin, East / West Berlin, Secret Agent, 1960s, C.I.A.",NA
"1027","Aug 8, 2014","The Hundred-Foot Journey","$22,000,000","$10,979,290","$54,235,441","$94,270,488","Play","Romantic Comedy","122 minutes","Immigration, Food, Professional Rivalry, Romance, Interracial Romance, France, Indians, Voiceover/Narration, Intertitle, Prologue, Widow/Widower, Romeo and Juliet Romance, December Romance, Culture Clash",NA
"1028","Nov 22, 2013","Delivery Man","$22,000,000","$7,944,977","$30,659,817","$70,536,870","Play","Comedy","105 minutes","Delayed Adulthood, Unexpected Families, Foreign-Language Remake, Secret Identity, Director Remaking Their Own Movie",NA
"1029","Oct 18, 2013","The Fifth Estate","$26,000,000","$1,673,351","$3,254,172","$6,154,172","Play","Drama","128 minutes","News, Investigative Journalist, Internet, Non-Chronological, Epilogue, Political, Iraq War, Government Corruption, Whistleblowers",NA
"1030","Nov 9, 2012","Lincoln","$65,000,000","$944,308","$182,207,973","$273,346,281","Play","Drama","149 minutes","Biography, Ensemble, Political, War, Civil War, Slavery, Intertitle, Dream Sequence, Voiceover/Narration, Death of a Son or Daughter, Hitmen, Political Assassination, Assassination, 2013 Oscars Best Picture Nominee",NA
"1031","Jun 29, 2012","People Like Us","$16,000,000","$4,255,423","$12,431,792","$12,617,472","Play","Drama","115 minutes","Inheritance, Dysfunctional Family, Unexpected Families",NA
"1032","Mar 9, 2012","A Thousand Words","$40,000,000","$6,176,280","$18,450,127","$20,790,486","Play","Comedy","91 minutes","Curses, Religious, Writing and Writers, New Age, Therapists / Therapy, Breaking the Fourth Wall, Dysfunctional Family",NA
"1033","Dec 25, 2011","War Horse","$70,000,000","$7,515,402","$79,883,359","$156,815,529","Play","Drama","146 minutes","World War I, War, Animal Lead, Ensemble, Addiction, Dysfunctional Family, Class Warfare, Orphan, 2012 Oscars Best Picture Nominee",NA
"1034","Oct 7, 2011","Real Steel","$110,000,000","$27,319,677","$85,463,309","$263,880,341","Play","Action","126 minutes","Boxing, Robot, Comeback, Underdog, Organized Crime, Gambling, Dysfunctional Family, Romance, Young Child Dealing with the Death of a Parent, IMAX: DMR",NA
"1035","Aug 19, 2011","Fright Night","$30,000,000","$8,114,388","$18,298,649","$40,520,649","Play","Horror","101 minutes","3-D, Coming of Age, Rescue, Stage Magician, Remake, Vampire, Horror Comedy",NA
"1036","Aug 10, 2011","The Help","$25,000,000","$26,044,590","$169,705,587","$213,120,004","Play","Drama","137 minutes","Bigotry, African-American, Writing and Writers, Boss From Hell, You Can't Go Home Again, Upstairs / Downstairs, Non-Chronological, Voiceover/Narration, 2012 Oscars Best Picture Nominee",NA
"1037","Jul 29, 2011","Cowboys and Aliens","$163,000,000","$36,431,290","$100,368,560","$176,038,324","Play","Action","118 minutes","Alien Invasion, Faulty Memory, Independent/Other Comics, Visual Effects, Foreign Language, Surprise Twist, IMAX: DMR",NA
"1038","Feb 18, 2011","I am Number Four","$50,000,000","$19,449,893","$55,100,437","$146,195,159","Play","Adventure","114 minutes","Friendly Alien on Earth, Alien Invasion, New Guy/Girl in School, Romance, Visual Effects, Secret Identity, Prologue, Voiceover/Narration, Coming of Age, Bullies, IMAX: DMR",NA
"1039","Jul 30, 2010","Dinner for Schmucks","$69,000,000","$23,527,839","$73,026,337","$86,796,502","Play","Comedy","114 minutes","Boss From Hell, Foreign-Language Remake, Epilogue",NA
"1040","Jun 24, 2009","Transformers: Revenge of th…","$210,000,000","$108,966,307","$402,111,870","$836,519,699","Play","Action","149 minutes","Robot, IMAX: DMR, Friendly Alien on Earth, Coming of Age, Politicians, Car Chase, Revenge, Narcotics, Fugitive / On the Run, Kidnap, Cover Up","Transformers"
"1041","Mar 20, 2009","I Love You, Man","$40,000,000","$17,810,270","$72,013,010","$92,302,502","","Comedy","105 minutes",NA,NA
"1042","Sep 26, 2008","Eagle Eye","$80,000,000","$29,150,721","$101,440,743","$180,585,259","","Thriller/Suspense","117 minutes","Terrorism, Surprise Twist, Artificial Intelligence, IMAX: DMR",NA
"1043","Sep 19, 2008","Ghost Town","$20,000,000","$5,012,315","$13,367,624","$29,958,228","","Romantic Comedy","102 minutes","Hauntings, Romance",NA
"1044","Aug 13, 2008","Tropic Thunder","$90,000,000","$25,812,796","$110,515,313","$191,145,256","","Comedy","106 minutes","Movie Business, War, Gratuitous Cameos",NA
"1045","Dec 21, 2007","Sweeney Todd: The Demon Bar…","","$9,300,805","$52,898,073","$153,329,844","","Musical","117 minutes","Serial Killer, Prison, Revenge, Food, Cannibalism",NA
"1046","Oct 19, 2007","Things We Lost in the Fire","$16,000,000","$1,561,949","$3,287,315","$8,120,148","","Drama","119 minutes",NA,NA
"1047","Jul 2, 2007","Transformers","$151,000,000","$70,502,384","$319,246,193","$708,272,592","","Action","142 minutes","Alien Invasion, Robot, Friendly Alien on Earth, End of the World, IMAX: DMR","Transformers"
"1048","Apr 13, 2007","Disturbia","$20,000,000","$22,224,982","$80,818,974","$118,537,627","","Thriller/Suspense","97 minutes","House Arrest",NA
"1049","Mar 30, 2007","Blades of Glory","$61,000,000","$33,014,202","$118,594,548","$145,594,548","","Comedy","93 minutes","Miscellaneous Sports, Olympics, Winter Sports, Figure Skating",NA
"1050","Feb 9, 2007","Norbit","","$34,195,434","$95,673,607","$158,973,607","","Comedy","103 minutes","Cross-Dressing, Fat Suit, Relationships Gone Wrong, Same Actor, Multiple Roles",NA
"1051","Dec 20, 2006","Letters from Iwo Jima","$13,000,000","$89,097","$13,756,082","$67,867,998","","Drama","101 minutes","World War II, Historical Battles, War",NA
"1052","Dec 15, 2006","Dreamgirls","$75,000,000","$378,950","$103,365,956","$155,708,695","","Musical","130 minutes","Music Industry, Musicians, African-American, Talent Contest",NA
"1053","Nov 3, 2006","Flushed Away","$149,000,000","$18,814,323","$64,665,672","$179,357,126","","Adventure","85 minutes","Culture Clash, Directing Yourself",NA
"1054","Oct 20, 2006","Flags of Our Fathers","$53,000,000","$10,245,190","$33,602,376","$63,657,941","","Drama","132 minutes","World War II, Historical Battles, War",NA
"1055","Dec 9, 2005","Memoirs of a Geisha","$85,000,000","$682,504","$57,010,853","$161,510,853","","Drama","137 minutes","Coming of Age",NA
"1056","Oct 21, 2005","Dreamer: Inspired by a True…","$32,000,000","$9,178,233","$33,022,286","$39,498,360","","Drama","102 minutes","Horse Racing, Miscellaneous Sports, Inspired by a True Story",NA
"1057","Aug 5, 2005","The Chumscrubber","$6,800,000","$28,548","$49,526","$49,526","","Drama",NA,NA,NA
"1058","Jun 29, 2005","War of the Worlds","$132,000,000","$64,878,725","$234,280,354","$606,836,535","","Action","116 minutes","Alien Invasion, Visual Effects, Voiceover/Narration, Illinois, England, France, Italy, Restaurants, War, 2000s, End of the World, Car Accident",NA
"1059","Dec 17, 2004","Lemony Snicket's A Series o…","$100,000,000","$30,061,756","$118,627,117","$212,956,024","","Adventure","107 minutes","Inheritance, Voiceover/Narration",NA
"1060","Aug 6, 2004","Collateral","$60,000,000","$24,701,458","$100,170,152","$217,670,152","","Action","120 minutes","Hitmen, Film Noir",NA
"1061","Jul 9, 2004","Anchorman: The Legend of Ro…","$25,000,000","$28,416,365","$84,136,909","$89,476,265","","Comedy","95 minutes","News, Gratuitous Cameos, Frat Pack, Judd Apatow Buddy Comedy, Based on an UNTRUE Story, Intertitle, Voiceover/Narration, Breaking the Fourth Wall, LGBT, Closeted Homosexual, Learning Disabilities, Animal Lead, TV News","Anchorman"
"1062","Jun 18, 2004","The Terminal","$75,000,000","$19,053,199","$77,073,959","$218,673,959","","Drama","128 minutes","Government Bureaucracy, Immigration, Language Barrier, Inspired by a True Story, Flight Attendant, Relationships Gone Wrong",NA
"1063","May 19, 2004","Shrek 2","$70,000,000","$108,037,878","$441,226,247","$937,008,132","","Adventure","92 minutes","In-Laws / Future In-Laws","Shrek"
"1064","Apr 30, 2004","Envy","$20,000,000","$6,160,886","$13,548,322","$14,566,246","","Comedy","99 minutes","Rags to Riches, Frat Pack",NA
"1065","Feb 20, 2004","Eurotrip","$25,000,000","$6,711,384","$17,718,223","$20,718,223","","Comedy",NA,NA,NA
"1066","Nov 21, 2003","The Cat in the Hat","$109,000,000","$38,329,160","$101,018,283","$133,818,283","","Adventure","82 minutes","Visual Effects",NA
"1067","Sep 19, 2003","Anything Else","$18,000,000","$1,673,125","$3,203,044","$13,203,044","","Romantic Comedy",NA,"Romance",NA
"1068","Jul 25, 2003","Seabiscuit","$86,000,000","$20,854,735","$120,277,854","$148,715,342","","Drama","140 minutes","Horse Racing, Inspired by a True Story, Inspirational Sports",NA
"1069","Jan 31, 2003","Biker Boyz","","$10,106,992","$21,908,034","$21,908,034","","Action","111 minutes",NA,NA
"1070","Dec 25, 2002","Catch Me if You Can","$52,000,000","$30,082,000","$164,606,800","$355,612,291","","Drama","140 minutes","Biography, Confidence Men, Fugitive / On the Run, Non-Chronological, Intertitle, Dysfunctional Family, Infidelity, Police Procedural, Voiceover/Narration, Runaway, Homeless, Lawyers, Doctors, Romance, Relationships Gone Wrong, Prostitution, Epilogue",NA
"1071","Jul 12, 2002","Road to Perdition","$80,000,000","$22,079,481","$104,054,514","$183,354,514","","Drama","116 minutes","Hitmen, Mafia, Road Trip, Revenge, D.C. Comics, Film Noir",NA
"1072","Jun 21, 2002","Minority Report","$102,000,000","$35,677,125","$132,024,714","$358,824,714","","Action","144 minutes","Visual Effects, Film Noir, Fugitive / On the Run",NA
"1073","Dec 21, 2001","A Beautiful Mind","$78,000,000","$367,151","$170,708,996","$317,668,058","","Drama","134 minutes","Biography, Surprise Twist, Mental Illness, Academics, War, Hallucinations, Oscars Best Picture Winner",NA
"1074","Oct 19, 2001","The Last Castle","$60,000,000","$7,088,213","$18,208,078","$20,541,668","","Drama","132 minutes",NA,NA
"1075","Aug 24, 2001","The Curse of the Jade Scorpion","$26,000,000","$2,459,315","$7,496,522","$18,496,522","","Comedy",NA,"Film Noir",NA
"1076","Jun 29, 2001","Artificial Intelligence: AI","$90,000,000","$29,352,630","$78,616,689","$235,900,000","","Drama","145 minutes","Robot, Voiceover/Narration, Artificial Intelligence, Living Toys, Medical and Hospitals, Dysfunctional Family, Prostitution, Post Apocalypse",NA
"1077","Jun 8, 2001","Evolution","$80,000,000","$13,408,351","$38,311,134","$98,341,932","","Comedy","101 minutes",NA,NA
"1078","Dec 22, 2000","Cast Away","$85,000,000","$28,883,406","$233,632,142","$427,230,516","","Drama","143 minutes","Marooned, Extreme Weather, 2000s, Lone Survivor",NA
"1079","Oct 13, 2000","The Contender","$9,000,000","$5,363,900","$17,804,273","$17,804,273","","Drama",NA,NA,NA
"1080","Oct 6, 2000","Meet the Parents","$55,000,000","$28,623,300","$166,225,040","$330,425,040","","Comedy","108 minutes","In-Laws / Future In-Laws, Frat Pack","Meet the Parents"
"1081","Sep 15, 2000","Almost Famous","$60,000,000","$2,314,646","$32,522,352","$47,371,191","","Comedy",NA,"Rock 'n' Roll, Coming of Age, Music Industry, Investigative Journalist, LGBT, Coming Out, On Tour",NA
"1082","Jul 21, 2000","What Lies Beneath","$90,000,000","$29,702,959","$155,464,351","$288,693,989","","Thriller/Suspense","126 minutes",NA,NA
"1083","May 5, 2000","Gladiator","$103,000,000","$34,819,017","$187,683,805","$457,683,805","","Action","154 minutes","Revenge, Posthumous Release, Oscars Best Picture Winner",NA
"1084","Dec 24, 1999","Galaxy Quest","$45,000,000","$7,012,630","$71,423,726","$90,523,726","","Adventure","102 minutes","Spoof",NA
"1085","Sep 15, 1999","American Beauty","$15,000,000","$861,531","$130,058,047","$356,258,047","","Drama","121 minutes","Dysfunctional Family, Mid-Life Crisis, Voiceover/Narration, Cheerleaders, Oscars Best Picture Winner",NA
"1086","Mar 19, 1999","Forces of Nature","","$13,510,728","$52,957,800","$93,957,800","","Romantic Comedy","102 minutes","Romance",NA
"1087","Oct 2, 1998","Antz","$60,000,000","$17,195,160","$90,757,863","$152,457,863","","Adventure","83 minutes",NA,NA
"1088","Jul 10, 1998","Small Soldiers","$40,000,000","$14,047,592","$55,143,823","$71,743,823","","Adventure","110 minutes","Living Toys",NA
"1089","Dec 19, 1997","Mouse Hunt","$38,000,000","$6,062,922","$61,894,591","$61,894,591","","Adventure","97 minutes","Animals Gone Bad, Animal Lead",NA
"1090","Dec 12, 1997","Amistad","$40,000,000","$4,573,523","$44,212,592","$58,250,151","","Drama","152 minutes","On a Boat, Mutiny, Slavery, Courtroom Drama, Intertitle, Culture Clash, Language Barrier, Epilogue",NA
"1091","","","","","","","",NA,NA,NA,NA
"1092","Averages","","$61,167,143","$19,152,708","$87,173,878","$172,700,511","",NA,NA,NA,NA
"1093","Totals","75","$4,281,700,000","","$6,450,866,972","$12,779,837,818","",NA,NA,NA,NA
"1094","Mar 29, 2018","Ready Player One","$150,000,000","$41,769,050","$137,018,455","$578,621,729","Play","Adventure","140 minutes","Near Future, Virtual Reality, Video Game, Environment, Government Corruption, Poverty, Treasure Hunters",NA
"1095","Feb 23, 2018","Game Night","$37,000,000","$17,005,332","$69,001,013","$117,201,013","Play","Comedy","93 minutes","Murder Mystery, Amatuer Slueth, Ensemble, Kidnap, Rescue",NA
"1096","Feb 9, 2018","The 15:17 to Paris","$30,000,000","$12,554,286","$36,250,957","$56,070,897","Play","Drama","94 minutes","Non-Chronological, 2010s, Ex-soldier, Terrorism, Trains, Nightclub, Non Professional Actor, Autobiographical",NA
"1097","Oct 13, 2017","6 Below: Miracle on the Mou…","","","","$641,491","","Thriller/Suspense","98 minutes","Early / Simultaneous Video on Demand release, Extreme Sports, Extreme Weather, Lost, Non-Chronological, Same Role, Multiple Actors, Rescue, Paralysis / Loss of a Limb, Addiction, Hockey, Inspired by a True Story",NA
"1098","Sep 22, 2017","The Lego Ninjago Movie","$70,000,000","$20,433,071","$59,281,555","$122,739,546","Play","Adventure","101 minutes","Ninja, Martial Arts, High School, Monster, Super Villains, Secret Identity, Dysfunctional Family","Lego"
