"","ReleaseDate","Title","ProductionBudget","OpeningWeekend","DomesticBox Office","WorldwideBox Office","Trailer","Genre","Running_Time","Keywords","Franchise"
"257","Jul 3, 2012","The Amazing Spider-Man","$220,000,000","$62,004,688","$262,030,663","$757,890,267","Play","Adventure","136 minutes","Marvel Comics, 3-D, Secret Identity, First Love, Visual Effects, Abandoned Child, Vigilante, Reboot, Inventor, Mad Scientist, IMAX: DMR","Spider-Man"
"258","Jun 15, 2012","That's My Boy","$57,500,000","$13,453,714","$36,931,089","$58,085,235","Play","Comedy","115 minutes","Fictionalized Version of Yourself, Delayed Adulthood, Gratuitous Cameos, Sex Crimes, Unexpected Pregnancy, Dysfunctional Family, Unexpected Families, Wedding Day, Bachelor Party, Strippers / Stripping, IRS, February / May Romance",NA
"259","May 25, 2012","Men in Black 3","$215,000,000","$54,592,779","$179,020,854","$654,213,485","Play","Adventure","104 minutes","3-D, Alien Invasion, Friendly Alien on Earth, Hitmen, Time Travel, Delayed Sequel, Buddy Comedy, Faulty Memory, Secret Agent, Marvel Comics, Visual Effects, Gratuitous Cameos, Same Role, Multiple Actors, Surprise Twist, IMAX: DMR","Men in Black"
"260","Apr 27, 2012","The Pirates! Band of Misfits","$55,000,000","$11,137,734","$31,051,126","$136,143,605","Play","Adventure","88 minutes","Pirates, Royalty, 3-D, Animal Lead, Hauntings, Academics, Monster, Intertitle, Cross-Dressing, Unnamed Character, Epilogue, Scene in End Credits, Rescue, Unrequited Love, Character's Journey Shown on Map",NA
"261","Mar 16, 2012","21 Jump Street","$42,000,000","$36,302,612","$138,447,667","$202,812,429","Play","Comedy","109 minutes","Undercover, Gratuitous Cameos, Narcotics, Buddy Cop, High School Hell, Prom, Slobs vs. Snobs","21 Jump Street"
"262","Feb 17, 2012","Ghost Rider: Spirit of Veng…","$57,000,000","$22,115,334","$51,774,002","$149,217,355","Play","Action","95 minutes","3-D, Visual Effects, Demons, Good vs. Evil, Marvel Comics, Sequels Without Their Original Stars","Ghost Rider"
"263","Dec 21, 2011","The Adventures of Tintin","$130,000,000","$9,720,993","$77,591,831","$373,993,951","Play","Adventure","104 minutes","3-D, Family Movie, Treasure Hunters, Pirates, Twins, Same Actor, Multiple Roles, Animal Lead, Addiction, IMAX: DMR","Tintin"
"264","Dec 20, 2011","The Girl with the Dragon Ta…","$90,000,000","$12,768,604","$102,515,793","$239,373,970","Play","Thriller/Suspense","160 minutes","Foreign-Language Remake, Private Investigator, News, Writing and Writers, Dysfunctional Family, Serial Killer, Sex Crimes, Revenge, Surprise Twist","Millennium (English)"
"265","Nov 23, 2011","Arthur Christmas","$85,000,000","$12,068,931","$46,462,469","$149,717,124","Play","Adventure","100 minutes","3-D, Christmas, Christmas in November, Dysfunctional Family",NA
"266","Nov 11, 2011","Jack and Jill","$79,000,000","$25,003,575","$74,158,157","$150,519,217","Play","Comedy","90 minutes","Dysfunctional Family, Twins, Same Actor, Multiple Roles, Cross-Dressing, Thanksgiving, Gratuitous Cameos, Directing Yourself",NA
"267","Oct 28, 2011","Anonymous","$27,500,000","$1,021,768","$4,463,292","$15,815,509","Play","Thriller/Suspense","130 minutes","Political, Royalty, Conspiracy Theory, Voiceover/Narration, Costume Drama, Based on an UNTRUE Story, Inspired by a True Story, Prologue, Writing and Writers, Performing Arts, Non-Chronological",NA
"268","Sep 23, 2011","Moneyball","$50,000,000","$19,501,302","$75,605,492","$111,300,835","Play","Drama","133 minutes","Baseball, Underdog, Epilogue, Intertitle, Non-Chronological, Same Role, Multiple Actors, 2012 Oscars Best Picture Nominee",NA
"269","Sep 9, 2011","Bucky Larson: Born to Be a …","$10,000,000","$1,415,023","$2,529,395","$2,529,395","Play","Comedy","96 minutes","Porn Business, Delayed Adulthood, Country Mouse, City Mouse",NA
"270","Aug 12, 2011","30 Minutes or Less","$28,000,000","$13,330,118","$37,053,924","$40,966,716","Play","Comedy","83 minutes","Hitmen, Dysfunctional Family, Heist, Buddy Comedy, Epilogue, Inspired by a True Story",NA
"271","Jul 8, 2011","Zookeeper","$80,000,000","$20,065,617","$80,360,866","$170,805,525","Play","Romantic Comedy","101 minutes","Romance, Relationships Gone Wrong, Mid-Life Crisis, Talking Animals, Animal Lead, Relationship Advice, Romance, Gratuitous Cameos",NA
"272","Mar 11, 2011","Battle: Los Angeles","$70,000,000","$35,573,187","$83,552,429","$213,463,976","Play","Action","116 minutes","Alien Invasion, Inspired by a True Story, Rescue, War, One Last Job",NA
"273","Feb 11, 2011","Just Go With It","$80,000,000","$30,514,732","$103,028,109","$214,974,953","Play","Romantic Comedy","115 minutes","Romance, Relationships Gone Wrong, Unexpected Families, Family Vacations, Gratuitous Cameos",NA
"274","Oct 1, 2010","The Social Network","$40,000,000","$22,445,653","$96,962,694","$224,922,135","Play","Drama","120 minutes","Same Actor, Multiple Roles, Twins, Internet, Boss From Hell, 2011 Oscars Best Picture Nominee",NA
"275","Aug 13, 2010","Eat Pray Love","$60,000,000","$23,104,523","$80,574,010","$206,598,789","Play","Drama","134 minutes","Romance, Food, Religious, Travelogue",NA
"276","Aug 6, 2010","Cemetery Junction","","","","$2,357,547","","Comedy",NA,NA,NA
"277","Jul 23, 2010","Salt","$130,000,000","$36,011,243","$118,311,368","$290,650,494","Play","Thriller/Suspense","100 minutes",NA,"Salt"
"278","Jun 25, 2010","Grown Ups","$75,000,000","$40,506,564","$162,001,186","$272,223,430","Play","Comedy","102 minutes",NA,"Grown Ups"
"279","Mar 19, 2010","The Bounty Hunter","$45,000,000","$20,686,423","$67,061,228","$135,808,837","Play","Romantic Comedy","111 minutes","Romance",NA
"280","Nov 13, 2009","2012","$200,000,000","$65,237,614","$166,112,167","$788,408,539","Play","Action","158 minutes","Disaster, End of the World, Extreme Weather, Visual Effects",NA
"281","Oct 28, 2009","Michael Jackson's This Is It","$60,000,000","$23,234,394","$72,091,016","$252,091,016","","Documentary","111 minutes","Music Industry, Pop Music, Split Screen, Scene in End Credits, Posthumous Release, IMAX: DMR",NA
"282","Oct 2, 2009","Zombieland","$23,600,000","$24,733,155","$75,590,286","$102,236,596","","Comedy","87 minutes","Zombies, Unnamed Character","Zombieland"
"283","Sep 18, 2009","Cloudy with a Chance of Mea…","$100,000,000","$30,304,648","$124,870,275","$236,827,677","","Adventure","90 minutes","3-D, Food, Inventor, IMAX: DMR","Cloudy with a Chance of Meatballs"
"284","Aug 7, 2009","Julie & Julia","$40,000,000","$20,027,956","$94,125,426","$126,646,119","Play","Comedy","122 minutes",NA,NA
"285","Jul 31, 2009","Funny People","$72,500,000","$22,657,780","$51,855,045","$71,880,305","","Comedy","146 minutes","Terminal Illness",NA
"286","Jul 24, 2009","The Ugly Truth","$38,000,000","$27,605,576","$88,915,214","$205,298,907","Play","Romantic Comedy","95 minutes","Romance",NA
"287","Jun 19, 2009","Year One","$60,000,000","$19,610,304","$43,337,279","$57,604,723","","Comedy","97 minutes","Judd Apatow Buddy Comedy",NA
"288","Jun 12, 2009","The Taking of Pelham 123","$110,000,000","$23,373,102","$65,452,312","$152,364,370","","Action","106 minutes",NA,NA
"289","May 15, 2009","Angels & Demons","$150,000,000","$46,204,168","$133,375,846","$490,875,846","","Thriller/Suspense","138 minutes",NA,"Da Vinci Code"
"290","Jan 16, 2009","Paul Blart: Mall Cop","$26,000,000","$31,832,636","$146,336,178","$185,904,750","","Adventure","91 minutes",NA,"Paul Blart: Mall Cop"
"291","Dec 19, 2008","Seven Pounds","$54,000,000","$14,851,136","$69,951,824","$166,617,328","","Drama","123 minutes",NA,NA
"292","Nov 14, 2008","Quantum of Solace","$230,000,000","$67,528,882","$169,368,427","$591,692,078","","Action","106 minutes","Secret Agent, Assassination, Shadowy Organization, 2000s, London, England, Betrayal, Terrorism","James Bond"
"293","Aug 6, 2008","Pineapple Express","$26,000,000","$23,245,025","$87,341,380","$102,404,019","","Comedy","112 minutes","Organized Crime, Corrupt Cops, Judd Apatow Buddy Comedy",NA
"294","Jul 25, 2008","Step Brothers","$65,000,000","$30,940,732","$100,468,793","$128,468,793","","Comedy","95 minutes","Unexpected Families, Dysfunctional Family, Delayed Adulthood, Judd Apatow Buddy Comedy",NA
"295","Jul 1, 2008","Hancock","$150,000,000","$62,603,879","$227,946,274","$624,234,272","","Action","92 minutes","Brooklyn, Martial Arts, Trains, Car Accident, Heist, Police Standoff, Faulty Memory, Hostage","Hancock"
"296","Jun 6, 2008","You Don't Mess With the Zohan","$90,000,000","$38,531,374","$100,018,837","$202,910,991","","Comedy","113 minutes","Secret Agent, Beauty Industry, Mistaken Identity, Judd Apatow Buddy Comedy",NA
"297","Mar 28, 2008","21","$35,000,000","$24,105,943","$81,159,365","$159,846,429","","Thriller/Suspense","122 minutes","Gambling, Whitewashed Casting",NA
"298","Feb 29, 2008","The Other Boleyn Girl","$40,000,000","$8,203,061","$26,814,957","$78,269,970","","Drama","115 minutes","Royalty, Costume Drama",NA
"299","Feb 22, 2008","Vantage Point","$40,000,000","$22,874,936","$72,266,306","$150,886,329","","Thriller/Suspense","89 minutes","Hitmen, Political",NA
"300","Dec 21, 2007","Walk Hard: The Dewey Cox Story","$35,000,000","$4,174,383","$18,317,151","$20,606,053","","Comedy","96 minutes","Spoof, Musicians, Judd Apatow Buddy Comedy",NA
"301","Aug 17, 2007","Superbad","$17,500,000","$33,052,411","$121,463,226","$169,955,142","","Comedy","112 minutes","Coming of Age, Judd Apatow Buddy Comedy",NA
"302","May 4, 2007","Spider-Man 3","$258,000,000","$151,116,516","$336,530,303","$894,860,230","","Adventure","139 minutes","Marvel Comics, Revenge, IMAX: DMR, Escape, Death of a Best Friend, Faulty Memory, College, College Professor, 2000s, Nightclub, Hostage","Spider-Man"
"303","Feb 16, 2007","Ghost Rider","$120,000,000","$45,388,836","$115,802,596","$229,545,589","","Action","110 minutes","Marvel Comics, Good vs. Evil, Demons, Heaven and Hell, Visual Effects","Ghost Rider"
"304","Dec 15, 2006","The Pursuit of Happyness","$55,000,000","$26,541,709","$162,586,036","$307,311,093","","Drama","117 minutes","Rags to Riches, Voiceover/Narration, Sales Clerk, Underdog, Job Interview, Messy Divorce, 1980s, Homeless, Family Affair, Relatives Playing Relatives",NA
"305","Dec 8, 2006","The Holiday","$85,000,000","$12,778,913","$63,280,000","$205,190,324","","Romantic Comedy","135 minutes","Christmas, Relationships Gone Wrong, Romance",NA
"306","Nov 17, 2006","Casino Royale","$102,000,000","$40,833,156","$167,365,000","$594,420,283","","Action","144 minutes","Secret Agent, Parkour, Gambling, Terrorism, Undercover, Hostage, Slow Motion Scene, Martial Arts","James Bond"
"307","Nov 10, 2006","Stranger Than Fiction","$30,000,000","$13,411,093","$40,435,190","$53,572,822","","Comedy","105 minutes","Writing and Writers, Writer's Block, Fiction / Reality Crossover",NA
"308","Sep 29, 2006","Open Season","$85,000,000","$23,624,548","$85,105,259","$191,932,158","","Adventure","86 minutes","3-D, IMAX: DMR, Animal Lead, Talking Animals","Open Season"
"309","Aug 4, 2006","Talladega Nights: The Balla…","$73,000,000","$47,042,215","$148,213,377","$162,870,525","","Comedy","104 minutes","Auto Racing, Judd Apatow Buddy Comedy",NA
"310","Jul 21, 2006","Monster House","$75,000,000","$22,217,226","$73,661,010","$141,267,370","","Adventure","91 minutes","3-D, Babysitters",NA
"311","Jun 23, 2006","Click","$82,500,000","$40,011,365","$137,355,633","$237,685,089","","Comedy","106 minutes","Time Travel",NA
"312","May 19, 2006","The Da Vinci Code","$125,000,000","$77,073,388","$217,536,138","$767,820,459","","Thriller/Suspense","152 minutes","Religious, Artists, Treasure Hunters, Secret Societies, Paris, France","Da Vinci Code"
"313","Apr 28, 2006","R.V.","$55,000,000","$16,414,767","$71,724,497","$87,473,024","","Adventure","98 minutes","Family Vacations, Dysfunctional Family, Road Trip",NA
"314","Dec 21, 2005","Fun With Dick And Jane","$140,000,000","$14,383,515","$110,550,000","$203,018,919","","Comedy","90 minutes","Judd Apatow Buddy Comedy",NA
"315","Dec 9, 2005","Memoirs of a Geisha","$85,000,000","$682,504","$57,010,853","$161,510,853","","Drama","137 minutes","Coming of Age",NA
"316","Nov 11, 2005","Zathura","$65,000,000","$13,427,872","$28,045,540","$58,545,540","","Adventure","95 minutes","Visual Effects","Jumanji"
"317","Oct 28, 2005","The Legend of Zorro","$80,000,000","$16,328,506","$45,575,336","$141,475,336","","Adventure","126 minutes",NA,"Zorro"
"318","Jul 29, 2005","Stealth","$138,000,000","$13,251,545","$32,116,746","$76,416,746","","Action","121 minutes","Visual Effects",NA
"319","Jun 24, 2005","Bewitched","$80,000,000","$20,131,130","$63,313,159","$131,159,306","","Comedy","98 minutes","Secret Magic",NA
"320","Jun 10, 2005","The Adventures of Sharkboy …","$50,000,000","$12,582,088","$39,177,684","$69,425,966","","Adventure","94 minutes","Visual Effects, 3-D, Voiceover/Narration, Bullies, Same Actor, Multiple Roles",NA
"321","May 27, 2005","The Longest Yard","$82,000,000","$47,606,480","$158,119,460","$191,558,505","","Comedy","113 minutes","Football, Prison",NA
"322","May 13, 2005","Layer Cake","$6,500,000","$81,706","$2,339,957","$11,745,931","","Thriller/Suspense",NA,"Surprise Twist, Film Noir, Unnamed Character, Narcotics, Organized Crime, Gangs, Novel or Other Work Adapted by Author",NA
"323","Feb 11, 2005","Hitch","$55,000,000","$43,142,214","$177,784,257","$366,784,257","","Romantic Comedy","117 minutes","Relationship Advice, Romance, Tabloid Journalism, Manhattan, New York, Wedding Day, Breaking the Fourth Wall",NA
"324","Dec 17, 2004","Spanglish","$75,000,000","$8,817,853","$42,044,321","$54,344,321","","Comedy","133 minutes","Dysfunctional Family",NA
"325","Jun 30, 2004","Spider-Man 2","$200,000,000","$88,156,227","$373,524,485","$795,110,670","","Adventure","127 minutes","Marvel Comics, Visual Effects, IMAX: DMR, Mental Illness, Artificial Intelligence, Cyborg","Spider-Man"
"326","Mar 12, 2004","Secret Window","$40,000,000","$18,237,568","$47,958,031","$92,111,551","","Thriller/Suspense","95 minutes","Surprise Twist, Writing and Writers, Film Noir, Writer's Block, Psychological Thriller",NA
"327","Dec 25, 2003","Peter Pan","$100,000,000","$11,139,495","$48,417,850","$95,255,485","","Adventure","113 minutes","Pirates, Fairies","Peter Pan"
"328","Dec 12, 2003","Something's Gotta Give","$80,000,000","$16,064,723","$124,685,242","$266,685,242","","Romantic Comedy","123 minutes","Romance",NA
"329","Dec 10, 2003","Big Fish","$70,000,000","$207,377","$66,432,867","$123,954,323","","Drama",NA,NA,NA
"330","Aug 8, 2003","S.W.A.T.","$70,000,000","$37,062,535","$116,877,597","$207,154,748","","Action","111 minutes",NA,NA
"331","Jul 18, 2003","Bad Boys II","$130,000,000","$46,522,560","$138,540,870","$273,271,982","","Action","140 minutes","Mafia, Buddy Cop, Buddy Comedy, African-American","Bad Boys"
"332","Jun 27, 2003","Charlie's Angels: Full Thro…","$120,000,000","$37,634,221","$100,814,328","$227,200,000","","Action","106 minutes","Gratuitous Cameos, Visual Effects","Charlie's Angels"
"333","Jun 13, 2003","Hollywood Homicide","$75,000,000","$11,112,632","$30,207,785","$50,409,753","","Action","115 minutes","Buddy Cop, Music Industry",NA
"334","Apr 25, 2003","Identity","$28,000,000","$16,225,263","$52,131,264","$82,183,683","","Thriller/Suspense","88 minutes","Serial Killer, Mental Illness, Extreme Weather, Surprise Twist, Prostitution, Fugitive / On the Run, Body in a Trunk",NA
"335","Mar 28, 2003","Basic","$50,000,000","$11,511,960","$26,599,248","$42,598,498","","Thriller/Suspense","98 minutes","Military Life, Film Noir",NA
"336","Nov 1, 2002","I Spy","$70,000,000","$12,752,803","$33,561,137","$60,279,822","","Action","92 minutes","Secret Agent, Buddy Cop",NA
"337","Jul 3, 2002","Men in Black 2","$140,000,000","$52,148,751","$190,418,803","$441,767,803","","Action","86 minutes","Visual Effects, Marvel Comics, Secret Agent, Faulty Memory, Buddy Comedy","Men in Black"
"338","Jun 28, 2002","Mr. Deeds","$50,000,000","$37,162,787","$126,293,452","$171,269,535","","Comedy","96 minutes","Inheritance, Country Mouse, City Mouse, News, Newspaper Industry, Romance, Rags to Riches",NA
"339","May 3, 2002","Spider-Man","$139,000,000","$114,844,116","$403,706,375","$821,706,375","","Adventure","121 minutes","Death of Other Extended Family, Visual Effects, Marvel Comics, Hallucinations, Mental Illness, Split Personality","Spider-Man"
"340","Apr 12, 2002","The Sweetest Thing","$43,000,000","$9,430,667","$24,430,272","$63,078,756","","Romantic Comedy","75 minutes","Road Trip, Romance",NA
"341","Dec 28, 2001","Black Hawk Down","$95,000,000","$179,823","$108,638,745","$159,691,085","","Action","144 minutes","Rescue",NA
"342","Dec 25, 2001","Ali","$109,000,000","$14,710,892","$58,183,966","$87,683,966","","Drama","158 minutes","Biography, Boxing, African-American",NA
"343","Dec 14, 2001","Not Another Teen Movie","$15,000,000","$12,615,116","$37,882,551","$62,401,343","","Comedy","82 minutes","Spoof",NA
"344","Sep 14, 2001","The Glass House","$22,000,000","$5,738,448","$17,951,431","$22,861,785","","Thriller/Suspense","120 minutes",NA,NA
"345","May 11, 2001","A Knight’s Tale","$41,000,000","$16,511,391","$56,083,966","$100,622,586","","Adventure","132 minutes",NA,NA
"346","Dec 19, 2000","Finding Forrester","$43,000,000","$701,207","$51,768,623","$80,013,623","","Drama","137 minutes","Writing and Writers",NA
"347","Nov 3, 2000","Charlie's Angels","$90,000,000","$40,128,550","$125,305,545","$259,736,090","","Action","98 minutes","Visual Effects","Charlie's Angels"
"348","Jun 28, 2000","The Patriot","$110,000,000","$22,413,710","$113,330,342","$215,300,000","","Drama","164 minutes","Revenge, Colonial United States, 1700s, Revolution",NA
"349","May 12, 2000","Center Stage","$18,000,000","$4,604,621","$17,200,925","$21,361,109","","Drama","113 minutes","Dancing","Center Stage"
"350","Apr 14, 2000","28 Days","$43,000,000","$10,310,672","$37,035,515","$62,063,972","","Comedy","104 minutes","Addiction, Rehab / Former Addict",NA
"351","Dec 17, 1999","Stuart Little","$105,000,000","$15,018,223","$140,015,224","$298,815,224","","Adventure","92 minutes","Talking Animals, Animal Lead, New York City, New York, Orphanage, Orphan, Kidnap, Adopted Family","Stuart Little"
"352","Jun 25, 1999","Big Daddy","$30,000,000","$41,536,370","$163,479,795","$228,641,283","","Comedy","95 minutes","1990s, Adopted Family, LGBT, Manhattan, New York",NA
"353","Dec 25, 1998","Stepmom","$50,000,000","$19,142,440","$91,137,662","$159,745,279","","Drama","120 minutes",NA,NA
"354","Jan 23, 1998","Spice World","$25,000,000","$10,527,222","$29,342,592","$56,042,592","","Comedy","93 minutes","Musicians, Music Industry, Paparazzi, Epilogue, Voiceover/Narration, Scene in End Credits, Breaking the Fourth Wall, Gratuitous Cameos",NA
"355","Jul 25, 1997","Air Force One","$85,000,000","$37,132,505","$172,956,409","$315,268,353","","Action","117 minutes","Terrorism, Hostage, In a Plane, Washington, D.C.",NA
"356","Mar 26, 1997","The Devil's Own","$90,000,000","$14,274,503","$42,885,593","$140,900,000","","Thriller/Suspense","107 minutes",NA,NA
"357","Sep 27, 1995","To Die For","$20,000,000","$386,610","$21,284,514","$27,688,744","","Black Comedy",NA,"TV Industry, Media Circus",NA
"358","Apr 7, 1995","Bad Boys","$23,000,000","$15,523,358","$65,647,413","$141,247,413","","Action","106 minutes","Buddy Cop, Buddy Comedy, African-American","Bad Boys"
"359","Nov 5, 1993","The Remains of the Day","$15,000,000","","$22,954,968","$63,954,968","","Drama",NA,"Costume Drama",NA
"360","Sep 3, 1993","Calendar Girl","","","$2,501,113","$2,501,113","","Drama","87 minutes",NA,NA
"361","Jul 9, 1993","In the Line of Fire","","$15,269,388","$102,243,874","$187,343,874","","Thriller/Suspense","123 minutes",NA,NA
"362","Nov 13, 1992","Bram Stoker's Dracula","$40,000,000","$30,521,679","$82,522,790","$215,862,692","","Horror","123 minutes","Monster, Vampire",NA
"363","Oct 9, 1992","A River Runs Through It","","","$43,440,294","$43,440,294","","Drama","123 minutes",NA,NA
"364","Aug 14, 1992","Single White Female","","$10,212,401","$48,017,402","$48,017,402","","Thriller/Suspense","107 minutes",NA,NA
"365","Dec 19, 1990","Awakenings","","","$51,636,504","$51,636,504","","Drama","121 minutes","Medical and Hospitals, Doctors",NA
"366","Oct 9, 1987","Someone to Watch Over Me","","$2,908,796","$10,278,549","$10,278,549","","Action","106 minutes","Film Noir",NA
"367","Jun 8, 1984","Ghostbusters","$30,000,000","$13,612,564","$242,212,467","$295,212,467","Play","Adventure","107 minutes","Visual Effects, Possessed, Hauntings, College, Academics, Paranormal Investigation, End of the World, Demons, New York, Supernatural","Ghostbusters"
"368","Dec 8, 1982","Gandhi","$22,000,000","$131,153","$52,767,889","$127,767,889","","Drama","191 minutes","Biography, Non-Chronological, Religious, Oscars Best Picture Winner",NA
"369","Jul 18, 1980","Used Cars","","","$11,715,321","$11,715,321","",NA,"112 minutes",NA,NA
"370","Jun 20, 1980","The Blue Lagoon","$4,500,000","","$47,923,795","$47,923,795","","Drama",NA,NA,NA
"371","Nov 16, 1977","Close Encounters of the Thi…","$20,000,000","","$169,100,479","$340,800,479","Play","Adventure","134 minutes","Friendly Alien on Earth, Visual Effects, First Contact",NA
"372","Apr 28, 1967","Casino Royale","$12,000,000","","$22,744,718","$41,744,718","","Comedy",NA,"Spoof, Same Actor, Multiple Roles, Adapted as a Comedy",NA
"373","Dec 16, 1962","Lawrence of Arabia","$15,000,000","","$37,495,385","$69,995,385","","Adventure","210 minutes","Biography, World War I",NA
"374","Apr 24, 1941","Penny Serenade","","","","","","Drama","117 minutes",NA,NA
"375","Jan 18, 1940","His Girl Friday","","","","","","Drama","92 minutes",NA,NA
"376","","","","","","","",NA,NA,NA,NA
"377","Averages","","$70,213,580","$25,086,490","$89,447,075","$198,968,205","",NA,NA,NA,NA
"378","Totals","183","$11,374,600,000","","$15,474,343,926","$35,217,372,246","",NA,NA,NA,NA
"379","Apr 2, 2021","Fast and Furious 10","","","","","","Action",NA,"Car Chase, Gangs, Organized Crime, Sequels With Returning Stars","Fast and the Furious"
"380","Dec 25, 2020","Sing 2","","","","","","Adventure",NA,NA,NA
"381","Jul 3, 2020","Minions 2","","","","","","Adventure",NA,NA,"Despicable MeMinions"
"382","Jun 7, 2019","The Secret Life of Pets 2","","","","","","Adventure",NA,NA,NA
"383","Mar 15, 2019","Us","","","","","","Thriller/Suspense",NA,NA,NA
"384","Dec 21, 2018","Welcome to Marwen","","","","","Play","Drama",NA,NA,NA
"385","Dec 14, 2018","Mortal Engines","$100,000,000","","","","Play","Action",NA,NA,NA
"386","Nov 9, 2018","Dr. Seuss’ The Grinch","$75,000,000","$67,572,855","$126,544,280","$151,744,280","Play","Adventure","86 minutes","Christmas, Christmas in November, Single Parent, Animal Lead, Widow/Widower, Young Child Dealing with the Death of a Parent, 3-D, Voiceover/Narration",NA
"387","Oct 19, 2018","Halloween","$10,000,000","$76,221,545","$158,814,140","$251,014,140","Play","Horror","105 minutes","Serial Killer, Supernatural, Teenage Slasher, Escape, Mental Hospital, Reboot, Delayed Sequel","Halloween"
"388","Oct 12, 2018","First Man","$60,000,000","$16,006,065","$44,356,310","$96,656,310","Play","Drama","141 minutes","1960s, Space Program, Astronaut, Astrophysics, Biography",NA
"389","Jul 20, 2018","Mamma Mia: Here We Go Again!","","$34,952,180","$120,634,935","$392,999,356","Play","Musical","114 minutes","Prequel, Non-Chronological, Pregnant Women, Romance, Love Triangle, Ensemble, Delayed Sequel","Mamma Mia"
"390","Jul 13, 2018","Skyscraper","$125,000,000","$24,905,015","$67,796,355","$304,103,613","Play","Action","103 minutes","Disaster, Rescue, FBI, Ex-soldier, Amputee, Hong Kong, Terrorism, Framed, Trapped, Domestic Abuse, Hostage, Suicide Bomber, Murder - Suicide, Prologue, Intertitle",NA
"391","Jul 4, 2018","The First Purge","$13,000,000","$17,374,280","$69,086,325","$136,244,120","Play","Horror","97 minutes","Political, Prequel, Serial Killer, Near Future, Dystopia, Class Warfare, Government Corruption, Terrorism","The Purge"
"392","Jun 22, 2018","Jurassic World: Fallen Kingdom","$170,000,000","$148,024,610","$416,769,345","$1,304,866,322","Play","Action","128 minutes","Dinosaurs in the Modern World, Animals Gone Bad, Cloning, Dinosaurs, Prologue, Visual Effects, Voiceover/Narration, Rescue, Death of a Son or Daughter, Surprise Twist, Betrayal, Sequels With Returning Stars, Relationships Gone Wrong, Exes in Love, Romance","Jurassic Park"
"393","May 11, 2018","Breaking In","$6,000,000","$17,630,285","$46,383,120","$50,931,527","Play","Thriller/Suspense","88 minutes","Hostage, Home Invasion, Rescue, Single Parent, Adult Child Dealing with the Death of a Parent, Inheritance, Prologue",NA
"394","Apr 6, 2018","Blockers","$21,000,000","$20,556,350","$59,839,515","$93,470,230","Play","Comedy","102 minutes","Epilogue, Prom, Loss Of Virginity, High School, Sex Comedy, Dysfunctional Family, Interracial Romance, LGBT, Closeted Homosexual, Coming Out, Prologue, Same Role, Multiple Actors, Teenage Sex Comedy, Single Parent, Empty Nest, Graduation, Scene in End Credits",NA
"395","Mar 23, 2018","Pacific Rim: Uprising","$155,000,000","$28,116,535","$59,185,715","$290,241,338","Play","Action","111 minutes","Mecha, Kaiju, 3-D, Ensemble, Father's Footsteps","Pacific Rim"
"396","Feb 9, 2018","Fifty Shades Freed","$55,000,000","$38,560,195","$100,407,760","$371,350,619","Play","Drama","120 minutes","Relationships Gone Wrong, Revenge, Fired, The Past Catching up with You, Sexual Fetishism, Exes in Love, Romance","Fifty Shades of Grey"
