"","ReleaseDate","Title","ProductionBudget","OpeningWeekend","DomesticBox Office","WorldwideBox Office","Trailer","Genre","Running_Time","Keywords","Franchise"
"638","Nov 5, 2004","The Incredibles","$92,000,000","$70,467,623","$261,441,092","$614,726,752","","Adventure","115 minutes","Family Movie, Boss From Hell, Secret Identity, Coming of Age, Robot, Dysfunctional Family, News, Voiceover/Narration, Breaking the Fourth Wall, Mid-Life Crisis, Surprise Twist, Prologue, Babysitters","The Incredibles"
"639","Aug 11, 2004","The Princess Diaries 2: Roy…","$45,000,000","$22,956,453","$95,149,435","$122,071,435","","Romantic Comedy","113 minutes","Prince/Princess, Tween, Royalty, Family Movie, Romance","Princess Diaries"
"640","Aug 6, 2003","Freaky Friday","$26,000,000","$22,203,007","$110,222,438","$160,822,438","","Comedy","97 minutes","Body Swap",NA
"641","Jul 9, 2003","Pirates of the Caribbean: T…","$140,000,000","$46,630,690","$305,411,224","$634,954,103","","Adventure","144 minutes","Pirates, Rescue, Treasure Hunters, Visual Effects, Fugitive / On the Run, 1700s","Pirates of the Caribbean"
"642","May 30, 2003","Finding Nemo","$94,000,000","$70,251,710","$380,529,370","$936,429,370","Play","Adventure","100 minutes","Faulty Memory, Underwater, Rescue, Family Movie, 3D Re-release, Talking Animals, Animal Lead, 3-D, Animals Gone Bad, Scene in End Credits, Prologue, Young Child Dealing with the Death of a Parent, Death of a Spouse or Fiancée / Fiancé, Dysfunctional Family, Spoiled Child","Finding Nemo"
"643","Nov 27, 2002","Treasure Planet","$100,000,000","$12,083,248","$38,120,554","$91,800,000","","Adventure","95 minutes","Treasure Hunters, Modern Adaptation, Pirates, Voiceover/Narration, Prologue, Non-Chronological, Robot, Cyborg, Abandoned Child, Dysfunctional Family, Romance, Epilogue, Development Hell",NA
"644","Jun 21, 2002","Lilo & Stitch","$80,000,000","$35,260,212","$145,771,527","$245,800,000","","Adventure","85 minutes","Genetic Engineering, Mad Scientist, Dysfunctional Family, Foster Family, Young Child Dealing with the Death of a Parent, Intertitle, Invented Language, Prologue, Directing Yourself, Screenplay Written By the Star, Epilogue","Lilo and Stitch"
"645","Nov 2, 2001","Monsters, Inc.","$115,000,000","$62,577,067","$289,423,425","$559,757,719","Play","Adventure","92 minutes","Christmas in November, Family Movie, 3D Re-release, Monster, Corporate Malfeasance, Undercover, Surprise Twist, Kidnap, Rescue, 3-D, Exile","Monsters, Inc."
"646","Aug 3, 2001","The Princess Diaries","$30,000,000","$22,862,269","$108,244,774","$165,334,774","","Comedy","115 minutes","Prince/Princess, Tween, Royalty, Family Movie, Ugly Duckling","Princess Diaries"
"647","Nov 22, 2000","102 Dalmatians","$85,000,000","$19,883,351","$66,941,559","$66,941,559","","Adventure","100 minutes","Live Action Cartoon","101 Dalmatians"
"648","Sep 29, 2000","Remember the Titans","$30,000,000","$20,905,831","$115,654,751","$136,706,683","","Drama","113 minutes","Football, Inspirational Coach, Bigotry, Inspired by a True Story, Inspirational Sports",NA
"649","Jul 7, 2000","The Kid","$65,000,000","$12,687,726","$69,688,384","$69,688,384","","Comedy","104 minutes",NA,NA
"650","May 19, 2000","Dinosaur","$127,500,000","$38,854,851","$137,748,063","$356,148,063","","Adventure","82 minutes",NA,NA
"651","Nov 19, 1999","Toy Story 2","$90,000,000","$300,163","$245,852,179","$511,358,276","","Adventure","92 minutes","Living Toys, Family Movie, 3-D","Toy Story"
"652","Feb 12, 1999","My Favorite Martian","$60,000,000","$11,181,043","$36,850,101","$36,850,101","","Comedy","94 minutes","Friendly Alien on Earth",NA
"653","Nov 20, 1998","A Bug's Life","$45,000,000","$291,121","$162,798,565","$363,095,319","","Adventure","96 minutes","Family Movie, Tiny Worlds",NA
"654","Jul 29, 1998","The Parent Trap","","$11,148,497","$66,308,518","$83,977,418","","Adventure","128 minutes","Twins, Same Actor, Multiple Roles",NA
"655","Nov 26, 1997","Flubber","$80,000,000","$26,725,207","$92,993,801","$177,993,801","","Comedy","94 minutes",NA,NA
"656","Mar 8, 1996","Homeward Bound II: Lost in …","","$8,605,649","$32,709,423","$32,709,423","","Adventure","89 minutes","Talking Animals","Homeward Bound"
"657","Feb 16, 1996","Muppet Treasure Island","","$10,112,833","$34,327,391","$34,327,391","","Adventure","99 minutes","Pirates, Treasure Hunters","Muppets"
"658","Jun 15, 1994","The Lion King","$79,300,000","$1,586,753","$421,785,283","$986,332,275","Play","Adventure","87 minutes","Coming of Age, Family Movie, Breaking the Fourth Wall, Animal Lead, Talking Animals, 3D Re-release","The Lion King"
"659","Oct 1, 1993","Cool Runnings","$14,000,000","$7,046,648","$68,856,263","$155,056,263","","Adventure","97 minutes","Miscellaneous Sports, Olympics, Winter Sports, Reggae",NA
"660","Mar 12, 1993","A Far Off Place","","$3,522,836","$12,890,752","$12,890,752","","Adventure","105 minutes",NA,NA
"661","Jun 23, 1989","Honey, I Shrunk the Kids","","$14,262,961","$130,724,172","$222,700,000","","Adventure","86 minutes","Visual Effects, Tiny Worlds","Honey I Shrunk the Kids"
"662","Feb 6, 1943","Saludos Amigos","","","","","","Adventure","42 minutes",NA,NA
"663","Oct 23, 1941","Dumbo","","","","$18,429","","Adventure","64 minutes","Animal Lead, Coming of Age, Same Actor, Multiple Roles, Talking Animals, Performing Arts, Voiceover/Narration, Black Out Drunk, Circus, Clowns","Dumbo"
"664","Nov 13, 1940","Fantasia","$2,280,000","","$83,320,000","$83,320,000","","Musical","126 minutes",NA,"Fantasia"
"665","Dec 21, 1937","Snow White and the Seven Dw…","$1,488,000","","$184,925,486","$184,925,486","","Musical","83 minutes","Intertitle, Prologue, Royalty, Dwarves, Prince/Princess, Love at First Sight, Step-Family, Mute",NA
"666","","","","","","","",NA,NA,NA,NA
"667","Averages","","$118,165,418","$36,952,291","$141,801,284","$334,127,811","",NA,NA,NA,NA
"668","Totals","103","$9,335,068,000","","$13,329,320,655","$31,742,142,006","",NA,NA,NA,NA
"669","2020","Guardians of the Galaxy Vol 3","","","","","","Action",NA,NA,"Marvel Cinematic UniverseGuardians of the Galaxy"
"670","Aug 2, 2019","The New Mutants","","","","","Play","Action",NA,"Marvel Comics, The Past Catching up with You, Survival Horror","X-Men"
"671","Jun 7, 2019","Dark Phoenix","","","","","Play","Action",NA,"Marvel Comics, Mutants, Psychics, Good vs. Evil","X-Men"
"672","May 3, 2019","Untitled Avengers Movie","","","","","","Action",NA,NA,"Marvel Cinematic Universe"
"673","Mar 8, 2019","Captain Marvel","","","","","Play","Action",NA,"War, Marvel Comics","Marvel Cinematic Universe"
"674","Dec 14, 2018","Spider-Man: Into The Spider…","","","","","Play","Adventure",NA,NA,NA
"675","Oct 5, 2018","Venom","$116,000,000","$80,255,756","$210,031,043","$780,531,043","Play","Action","112 minutes","Parasite, Investigative Journalist, Marvel Comics, Super Villains, Mad Scientist, Body Horror, Scene in End Credits","Sony’s Marvel Universe"
"676","Jul 6, 2018","Ant-Man and the Wasp","$130,000,000","$75,812,205","$216,648,740","$617,260,330","Play","Action","118 minutes","Marvel Comics, Tiny Worlds, Fugitive / On the Run, House Arrest, Father's Footsteps, Dysfunctional Family, Ensemble, Prologue, 1980s, Intertitle, FBI, Corrupt Cops, Scientific Experiment Gone Awry, Inventor","Ant-ManMarvel Cinematic Universe"
"677","May 18, 2018","Deadpool 2","$110,000,000","$125,507,153","$318,491,426","$733,809,601","Play","Action","119 minutes","Marvel Comics, Breaking the Fourth Wall, Time Travel, Rescue, Mercenaries, Mutants","DeadpoolX-Men"
"678","Apr 27, 2018","Avengers: Infinity War","$300,000,000","$257,698,183","$678,815,482","$2,008,425,124","Play","Action","156 minutes","Marvel Comics, Robot, End of the World, Hallucinations, Super Villains, Ensemble, Franchise Crossover, Outer Space, Gods and Goddesses, Non-Chronological, Death of a Sibling","Marvel Cinematic Universe"
"679","Feb 16, 2018","Black Panther","$200,000,000","$202,003,951","$700,059,566","$1,347,071,259","Play","Action","120 minutes","Martial Arts, Marvel Comics, Royalty, Magical Technology, World War III, Civil War, Rebellion, Ensemble, Africa, Fictional Country, Prologue, 1990s, Intertitle, Undercover, London, England, South Korea, Seoul, Non-Chronological, Dysfunctional Family, Scene in End Credits","Marvel Cinematic Universe"
"680","Nov 3, 2017","Thor: Ragnarok","$180,000,000","$122,744,989","$315,058,289","$846,980,024","Play","Action","130 minutes","Marvel Comics, Norse Mythology, Gods and Goddesses, End of the World, Prophecy, Underworld, Gladiators, Directing Yourself, Dysfunctional Family, Unexpected Families, Adult Child Dealing with the Death of a Parent, Non-Chronological, Gratuitous Cameos","ThorMarvel Cinematic UniverseHulk"
"681","Jul 7, 2017","Spider-Man: Homecoming","$175,000,000","$117,027,503","$334,201,140","$880,070,886","Play","Action","133 minutes","Marvel Comics, Reboot, Super Villains, High School, Coming of Age, Secret Identity, Revenge","Spider-ManMarvel Cinematic Universe"
"682","May 5, 2017","Guardians of the Galaxy Vol 2","$200,000,000","$146,510,104","$389,813,101","$862,317,259","Play","Action","136 minutes","Marvel Comics, Humans as Aliens, Interspecies Romance, Romance, Unrequited Love, Adopted Family, Family Affair, Sibling Rivalry, Family Secrets, Psychics, Animal Lead, Talking Animals, Visual Effects, Digital Cinematography, 3-D, 3-D - Shot in 3-D, Ensemble, Gratuitous Cameos, Intertitle, 1980s, Dysfunctional Family","Marvel Cinematic UniverseGuardians of the Galaxy"
"683","Mar 3, 2017","Logan","$127,000,000","$88,411,916","$226,277,068","$615,476,965","Play","Action","135 minutes","Road Trip, Mutants, Autumn Years, Dystopia, Bad Role Models, Psychics, Marvel Comics, Faulty Memory, Cloning, Unexpected Families, Fugitive / On the Run, Super Soldiers, Near Future, 2020s, Money Troubles, Medical Crimes, Human Experimentation, Corporate Malfeasance","WolverineX-Men"
"684","Nov 4, 2016","Doctor Strange","$165,000,000","$85,058,311","$232,641,920","$676,486,457","Play","Action","115 minutes","Marvel Comics, Secret Magic, Origin Story, Car Accident, Paralysis / Loss of a Limb, New York City, London, Hong Kong, Alternative Dimensions / Parallel universe, Same Actor, Multiple Roles, Scene in End Credits, Demons","Marvel Cinematic Universe"
"685","May 27, 2016","X-Men: Apocalypse","$178,000,000","$65,769,562","$155,442,489","$542,708,779","Play","Action","136 minutes","Marvel Comics, Mutants, Visual Effects, End of the World, Ancient Egypt","X-Men"
"686","May 6, 2016","Captain America: Civil War","$250,000,000","$179,139,142","$408,084,349","$1,140,871,507","Play","Action","146 minutes","Marvel Comics, Friends turned Enemies, Government Corruption, Rebellion, 1990s, Prologue, Scene in End Credits, Framed, Gratuitous Cameos, Visual Effects, Intertitle, Assassination, Young Child Dealing with the Death of a Parent, Siberia, Nigeria, Russia, Revenge, Death of a Spouse or Fiancée / Fiancé, Death of a Son or Daughter, Surprise Twist, Super Soldier Serum, Voiceover/Narration","Captain AmericaMarvel Cinematic Universe"
"687","Feb 12, 2016","Deadpool","$58,000,000","$132,434,639","$363,070,709","$801,029,249","Play","Action","107 minutes","Terminal Illness, Cancer, Special Ops, Romance, Medical Crimes, Human Experimentation, Revenge, Gratuitous Cameos, Development Hell, Marvel Comics","X-MenDeadpool"
"688","Aug 7, 2015","Fantastic Four","$120,000,000","$25,685,737","$56,117,548","$167,977,596","Play","Action","100 minutes","Development Hell, Scientific Experiment Gone Awry, Famously Bad, Area 51, Origin Story, Marvel Comics, Reboot, Alternative Dimensions / Parallel universe, End of the World, 2000s, Surprise Twist, Character POV shot","Fantastic Four"
"689","Jul 17, 2015","Ant-Man","$130,000,000","$57,225,526","$180,202,163","$518,860,086","Play","Action","117 minutes","Marvel Comics, Shrinking, Origin Story, Heist, Life on the Outside, Inventor, Going Legit, San Francisco, Screenplay Written By the Star, Gratuitous Cameos, Intertitle, 1980s, Training Montage, Mad Scientist, Prologue, Non-Chronological, Death of a Spouse or Fiancée / Fiancé, Young Child Dealing with the Death of a Parent","Marvel Cinematic UniverseAnt-Man"
"690","May 1, 2015","Avengers: Age of Ultron","$330,600,000","$191,271,109","$459,005,868","$1,405,057,855","Play","Action","141 minutes","Marvel Comics, Robot, End of the World, Hallucinations","Marvel Cinematic Universe"
"691","Aug 1, 2014","Guardians of the Galaxy","$170,000,000","$94,320,883","$333,172,112","$770,867,516","Play","Action","121 minutes","Marvel Comics, Heist, End of the World, Alien Abduction, Orphan, Smuggler, Hitmen, Mercenaries, Animal Lead, Talking Animals, Redemption, Ensemble, Intertitle, Prologue, Terminal Illness, Young Child Dealing with the Death of a Parent, Gratuitous Cameos, Prison, Prison Break, Cruel Wardens or Prison Guards","Marvel Cinematic UniverseGuardians of the Galaxy"
"692","May 2, 2014","The Amazing Spider-Man 2","$200,000,000","$91,608,337","$202,853,933","$708,996,336","Play","Action","141 minutes","3-D, Corporate Malfeasance, Revenge, Terminal Illness, Genetic Engineering, 3-D - Shot in 3-D, Marvel Comics","Spider-Man"
"693","Apr 4, 2014","Captain America: The Winter…","$170,000,000","$95,023,721","$259,746,958","$714,401,889","Play","Action","135 minutes","3-D, Terrorism, Government Corruption, Surprise Twist, Marvel Comics, Non-Chronological, Cyborg, Epilogue, Scene in End Credits, Hostage, Intertitle, Rescue, Faked Death, Returning Soldiers, Old Age Makeup","Captain AmericaMarvel Cinematic Universe"
"694","Nov 8, 2013","Thor: The Dark World","$150,000,000","$85,737,841","$206,362,140","$644,602,516","Play","Action","111 minutes","Gods and Goddesses, Sibling Rivalry, End of the World, Adopted Family, Marvel Comics, Scene in End Credits, Surprise Twist, Voiceover/Narration, Prologue, Invented Language, Intertitle, Non-Chronological, Revenge, Gratuitous Cameos, Death of a Spouse or Fiancée / Fiancé, Young Child Dealing with the Death of a Parent, 3-D","ThorMarvel Cinematic Universe"
"695","Jul 26, 2013","The Wolverine","$115,000,000","$53,113,752","$132,556,852","$416,456,852","Play","Action","126 minutes","Romance, Marvel Comics, Organized Crime, Mutants, Depression, PTSD, Scene in End Credits, 3-D","WolverineX-Men"
"696","May 3, 2013","Iron Man 3","$200,000,000","$174,144,585","$408,992,272","$1,215,392,272","Play","Action","130 minutes","Marvel Comics, Terrorism, False Identity, Addiction, Artificial Intelligence, Robot, Government Corruption, Non-Chronological, Super Soldiers, Surprise Twist, Visual Effects, Prologue, Voiceover/Narration, Intertitle, Gratuitous Cameos, Epilogue, 3-D, 1990s, Archival Footage of Previous Installment, PTSD, Scene in End Credits","Iron ManMarvel Cinematic Universe"
"697","Jul 3, 2012","The Amazing Spider-Man","$220,000,000","$62,004,688","$262,030,663","$757,890,267","Play","Adventure","136 minutes","Marvel Comics, 3-D, Secret Identity, First Love, Visual Effects, Abandoned Child, Vigilante, Reboot, Inventor, Mad Scientist, IMAX: DMR","Spider-Man"
"698","May 4, 2012","The Avengers","$225,000,000","$207,438,708","$623,279,547","$1,517,935,897","Play","Action","143 minutes","Marvel Comics, 3-D, Gods and Goddesses, Mutants, Visual Effects, Special Ops, Alien Invasion, Revenge, Franchise Crossover, Non-Chronological, Ensemble, Gratuitous Cameos, Epilogue, Scene in End Credits, IMAX: DMR, Sequel With Lead Character Recast, Good vs. Evil, Faked Death, Mind Control","Marvel Cinematic Universe"
"699","Feb 17, 2012","Ghost Rider: Spirit of Veng…","$57,000,000","$22,115,334","$51,774,002","$149,217,355","Play","Action","95 minutes","3-D, Visual Effects, Demons, Good vs. Evil, Marvel Comics, Sequels Without Their Original Stars","Ghost Rider"
"700","Jul 22, 2011","Captain America: The First …","$140,000,000","$65,058,524","$176,654,505","$370,569,776","Play","Action","124 minutes","Marvel Comics, 3-D, Origin Story, World War II, Epilogue, Good vs. Evil, Nazis, Prologue, Non-Chronological, War, Orphan, Presumed Dead, Occult, Visual Effects, Gratuitous Cameos, Super Soldier Serum, Rescue, Intertitle, Norse Mythology","Captain AmericaMarvel Cinematic Universe"
"701","Jun 3, 2011","X-Men: First Class","$160,000,000","$55,101,604","$146,408,305","$355,408,305","Play","Action","132 minutes","Mutants, Boarding School, New Guy/Girl in School, Prequel, Ensemble, Gratuitous Cameos, Marvel Comics, Political, LGBT, Religious, Non-Chronological, Nazis, Terrorism","X-Men"
"702","May 6, 2011","Thor","$150,000,000","$65,723,338","$181,030,624","$449,326,618","Play","Action","113 minutes","Marvel Comics, Gods and Goddesses, Banishment, Dysfunctional Family, Revenge, Romance, Culture Clash, Cross-Class Romance, Academics, 3-D, Prologue, Non-Chronological, Voiceover/Narration, Sword & Sorcerer, Visual Effects, Epilogue, IMAX: DMR, Scene in End Credits, Origin Story, New Mexico, Field Scientists, Adopted Family, False Identity, Family Secrets, Norse Mythology","ThorMarvel Cinematic Universe"
"703","May 7, 2010","Iron Man 2","$170,000,000","$128,122,480","$312,433,331","$621,156,389","Play","Action","125 minutes","Marvel Comics, Inventor, Revenge, Cold War, IMAX: DMR, Sequel With Lead Character Recast, Voiceover/Narration, Intertitle, Moscow, Gratuitous Cameos, Scene in End Credits, Adult Child Dealing with the Death of a Parent, Falsely Accused, Medical and Hospitals, Terminal Illness, Archival Footage of Previous Installment, Washington, D.C., Monaco, Auto Racing, Professional Rivalry, Robot","Iron ManMarvel Cinematic Universe"
"704","May 1, 2009","X-Men Origins: Wolverine","$150,000,000","$85,058,003","$179,883,157","$374,825,760","","Action","107 minutes","Marvel Comics","X-MenWolverine"
"705","Dec 5, 2008","Punisher: War Zone","$35,000,000","$4,271,451","$8,050,977","$10,157,534","","Action","103 minutes",NA,"Punisher"
"706","Jun 13, 2008","The Incredible Hulk","$137,500,000","$55,414,050","$134,806,913","$265,573,859","","Adventure","112 minutes","Marvel Comics, Mutants, Gratuitous Cameos, Fugitive / On the Run, Medical and Hospitals, Brazil, Intertitle, Super Soldiers, Special Ops, Super Soldier Serum, Human Experimentation","HulkMarvel Cinematic Universe"
"707","May 2, 2008","Iron Man","$186,000,000","$102,118,668","$318,604,126","$585,171,547","","Adventure","126 minutes","Marvel Comics, Corporate Malfeasance, Surprise Twist, Kidnap, Terrorism, Afghanistan War, Scene in End Credits, Arms Dealer, Inventor, Voiceover/Narration, Non-Chronological, Intertitle, Gratuitous Cameos, Origin Story","Iron ManMarvel Cinematic Universe"
"708","Jun 15, 2007","Fantastic Four: Rise of the…","$120,000,000","$58,051,684","$131,921,738","$289,480,691","","Action","91 minutes","Marvel Comics, Alien Invasion, End of the World, Visual Effects","Fantastic Four"
"709","May 4, 2007","Spider-Man 3","$258,000,000","$151,116,516","$336,530,303","$894,860,230","","Adventure","139 minutes","Marvel Comics, Revenge, IMAX: DMR, Escape, Death of a Best Friend, Faulty Memory, College, College Professor, 2000s, Nightclub, Hostage","Spider-Man"
"710","Jul 8, 2005","Fantastic Four","$87,500,000","$56,061,504","$154,696,080","$333,132,750","","Action","106 minutes","Marvel Comics, Visual Effects","Fantastic Four"
"711","Jan 14, 2005","Elektra","$65,000,000","$12,804,793","$24,409,722","$56,824,633","","Action","97 minutes","Marvel Comics, Visual Effects, Non-Chronological",NA
"712","Jun 30, 2004","Spider-Man 2","$200,000,000","$88,156,227","$373,524,485","$795,110,670","","Adventure","127 minutes","Marvel Comics, Visual Effects, IMAX: DMR, Mental Illness, Artificial Intelligence, Cyborg","Spider-Man"
"713","Apr 16, 2004","The Punisher","$33,000,000","$13,834,527","$33,664,370","$54,533,774","","Action","124 minutes","Marvel Comics, Revenge","Punisher"
"714","Jun 20, 2003","Hulk","$137,000,000","$62,128,420","$132,177,234","$245,075,434","","Action","138 minutes","Marvel Comics, Visual Effects, Split Screen","Hulk"
"715","Feb 14, 2003","Daredevil","$80,000,000","$40,310,418","$102,543,518","$182,782,518","","Action","125 minutes","Marvel Comics, Visual Effects, Film Noir",NA
"716","May 3, 2002","Spider-Man","$139,000,000","$114,844,116","$403,706,375","$821,706,375","","Adventure","121 minutes","Death of Other Extended Family, Visual Effects, Marvel Comics, Hallucinations, Mental Illness, Split Personality","Spider-Man"
"717","Jul 14, 2000","X-Men","$75,000,000","$54,471,475","$157,299,717","$296,872,367","","Action","104 minutes","Visual Effects, Marvel Comics, Mutants, Terrorism, 2000s, High School, New York, 1940s, Nazis","X-Men"
"718","","","","","","","",NA,NA,NA,NA
"719","Averages","","$153,479,070","$94,202,591","$256,583,136","$647,517,771","",NA,NA,NA,NA
"720","Totals","49","$6,599,600,000","","$11,033,074,860","$27,843,264,150","",NA,NA,NA,NA
"721","2019","Crawl","","","","","","Horror",NA,NA,NA
"722","Nov 16, 2018","Instant Family","","$14,700,000","$14,700,000","$14,700,000","Play","Comedy","119 minutes","Unexpected Families, Family Movie, Adopted Family, Orphan, Young Child Dealing with the Death of a Parent",NA
"723","Nov 9, 2018","Overlord","","$10,202,108","$17,742,889","$26,759,501","Play","Action","109 minutes","World War II, Nazis, Scientific Experiment Gone Awry, Behind Enemy Lines, Occult, Super Soldiers",NA
"724","Nov 2, 2018","Nobody’s Fool","$19,000,000","$13,743,111","$28,887,618","$29,152,618","Play","Drama","110 minutes","African-American, Life on the Outside, Dysfunctional Family, Romance, Internet Dating, Catfishing",NA
"725","Jul 27, 2018","Mission: Impossible—Fallout","$178,000,000","$61,236,534","$220,159,104","$787,978,070","Play","Action","147 minutes","C.I.A., Secret Agent, Hitmen, 3-D, Prison Break, Ensemble","Mission: Impossible"
"726","Jun 1, 2018","Action Point","$19,000,000","$2,390,164","$5,059,608","$5,103,675","Play","Comedy","84 minutes","Daredevil, Amusement Park, Prologue, Non-Chronological, Corporations vs. Mom and Pop Store, Dysfunctional Family, Old Age Makeup",NA
"727","May 18, 2018","Book Club","$10,000,000","$13,582,231","$68,566,296","$89,761,473","Play","Comedy","104 minutes","Widow/Widower, Death of a Spouse or Fiancée / Fiancé, Relationships Gone Wrong, Romance",NA
"728","Apr 6, 2018","A Quiet Place","$17,000,000","$50,203,562","$188,024,361","$334,524,361","Play","Horror","95 minutes","Near Future, 2020s, Directing Yourself, Screenplay Written By the Star, Deaf, Sign Language, Limited Dialogue, Family Affair, Psychological Horror, Relatives Playing Relatives, Isolation Horror, Life on a Farm, Alien Invasion, Intertitle, Prologue",NA
"729","Mar 23, 2018","Sherlock Gnomes","$59,000,000","$10,604,774","$43,242,871","$87,650,172","Play","Adventure","86 minutes","Private Investigator, Romance, Animated Inanimate Objects, Delayed Sequel, Missing Person","Gnomeo and Juliet"
"730","Feb 23, 2018","Annihilation","$55,000,000","$11,071,584","$32,732,301","$43,070,915","Play","Thriller/Suspense","115 minutes","Unnamed Character, Environment, Scientific Expedition, Isolation Horror",NA
"731","Dec 22, 2017","Downsizing","$68,000,000","$4,954,287","$24,449,754","$48,681,134","Play","Comedy","135 minutes","Tiny Worlds, Human Experimentation, Therapists / Therapy, Therapist, Relationships Gone Wrong, Gratuitous Cameos",NA
"732","Nov 10, 2017","Daddy’s Home 2","$70,000,000","$29,651,193","$104,029,443","$175,809,810","Play","Comedy","100 minutes","Step-Family, Dysfunctional Family, Christmas, Christmas in November","Daddy’s Home"
"733","Oct 20, 2017","Same Kind of Different as Me","","$2,591,985","$6,423,605","$6,423,605","Play","Drama","120 minutes","Faith-Based, Dysfunctional Family, Homeless, Prophetic Dreams, Dream Sequence, Romance",NA
"734","Sep 15, 2017","mother!","$30,000,000","$7,534,673","$17,800,004","$42,531,278","Play","Thriller/Suspense","108 minutes","Dysfunctional Family, Film Actor, Psychological Thriller",NA
"735","Jun 21, 2017","Transformers: The Last Knight","$217,000,000","$44,680,073","$130,168,683","$602,893,340","Play","Action","148 minutes","Robot, War, Archaeology, Car Chase, Redemption, Prologue, Voiceover/Narration","Transformers"
"736","May 25, 2017","Baywatch","$60,000,000","$18,503,871","$58,060,186","$175,869,759","Play","Comedy","119 minutes","Lifeguard, California, Professional Rivalry, Organized Crime, Amatuer Slueth, Adapted as a Comedy",NA
"737","Mar 31, 2017","Ghost in the Shell","$110,000,000","$18,676,033","$40,563,557","$167,918,847","Play","Action","100 minutes","Live Action Cartoon, Robot, Cyborg, Dystopia, Implanted Memory, Organized Crime",NA
"738","Feb 3, 2017","Rings","$25,000,000","$13,002,632","$27,793,018","$82,933,201","Play","Horror","102 minutes","Supernatural, Curses, Delayed Sequel, Development Hell, Delayed Release","Ring"
"739","Jan 20, 2017","xXx: Return of Xander Cage","$85,000,000","$20,130,142","$44,898,413","$345,044,476","Play","Action","110 minutes","Delayed Sequel, Sequels With Returning Stars, Secret Agent, Extreme Sports, Out of Retirement, Faked Death, Conspiracy Theory","xXx"
"740","Jan 13, 2017","Monster Trucks","$125,000,000","$10,950,705","$33,370,166","$61,642,798","Play","Adventure","104 minutes","Monster, Monster Trucks, Friendly Alien on Earth, Development Hell",NA
"741","Dec 16, 2016","Fences","$24,000,000","$129,462","$57,682,904","$64,282,881","Play","Drama","133 minutes","Directing Yourself, Novel or Other Work Adapted by Author, Pittsburgh, 1950s, Former Professional Athlete, Baseball, African-American, 2017 Oscars Best Picture Nominee",NA
"742","Nov 23, 2016","Allied","$106,000,000","$12,701,743","$40,098,064","$119,280,834","Play","Drama","124 minutes","1940s, North Africa, World War II, Secret Agent, Dysfunctional Family",NA
